<?xml version="1.0" encoding="UTF-8"?>

<!DOCTYPE Waterball:WebSite SYSTEM "triMago.dtd">

<Waterball:WebSite 
	xmlns:Waterball="http://g9.xml.csie.mcu.edu.tw"
	infoAmount="0"
	siteRate="4">
	<Waterball:restaurant
		id="r0"
		name="癮食上癮"
		latitude="121.336" 
		longitude="24.9966"
		typeOfMeal="便當飯類"
		price="80">
		<Waterball:comment>
			<Waterball:name>水球</Waterball:name>
			<Waterball:date>2017/3/10</Waterball:date>
			<Waterball:content>很奇怪，他的椒麻雞，只是鹹酥雞+醬汁而已...</Waterball:content>
			<Waterball:rate>3</Waterball:rate>
		</Waterball:comment>
		
	</Waterball:restaurant>
	
	
	
	<Waterball:restaurant
		id="r1"
		name="美國時間"
		latitude="121.336" 
		longitude="24.9966"
		typeOfMeal="早餐 早午餐"
		price="40">
		<Waterball:comment>
			<Waterball:name>昇昇</Waterball:name>
			<Waterball:date>2017/3/15</Waterball:date>
			<Waterball:content>難吃，馬的。</Waterball:content>
			<Waterball:rate>1</Waterball:rate>
		</Waterball:comment>
	</Waterball:restaurant>
</Waterball:WebSite>